{
    "$schema": "http://json-schema.org/draft-07/schema",
    "required": [
        "formatType",
        "formatVersion"
    ],
    "properties": {
        "formatType": {
            "const": "instance"
        },
        "formatVersion": {
            "const": 0
        },
        "project": {
            "$ref": "meta.schema.json#/definitions/projectMeta"
        },
        "version": {
            "$ref": "meta.schema.json#/definitions/versionMeta"
        },
        "assets": {
            "type": "array",
            "items": {
                "type": "object",
                "required": [
                    "id",
                    "type",
                    "env",
                    "file"
                ],
                "properties": {
                    "id": {
                        "type": "string"
                    },
                    "type": {
                        "enum": [
                            "local",
                            "remote"
                        ]
                    },
                    "env": {
                        "$ref": "meta.schema.json#/definitions/env"
                    },
                    "file": {
                        "$ref": "meta.schema.json#/definitions/fileMeta"
                    },
                    "groups": {
                        "type": "array",
                        "items": {
                            "type": "string"
                        }
                    }
                },
                "oneOf": [
                    {
                        "properties": {
                            "type": {
                                "const": "local"
                            }
                        }
                    },
                    {
                        "properties": {
                            "type": {
                                "const": "remote"
                            },
                            "file": {
                                "required": [
                                    "downloads",
                                    "hashes",
                                    "size"
                                ]
                            }
                        }
                    }
                ]
            }
        },
        "groups": {
            "type": "object",
            "additionalProperties": {
                "type": "object",
                "required": [
                    "name"
                ],
                "properties": {
                    "name": {
                        "type": "string"
                    },
                    "description": {
                        "type": "string"
                    },
                    "overrides": {
                        "type": "string"
                    },
                    "env": {
                        "$ref": "meta.schema.json#/definitions/env"
                    },
                    "conflicts": {
                        "type": "array",
                        "items": {
                            "type": "string"
                        }
                    },
                    "requires": {
                        "type": "array",
                        "items": {
                            "type": "string"
                        }
                    }
                }
            }
        },
        "components": {
            "type": "object",
            "description": "Required components for the Pack",
            "required": [
                "minecraft"
            ],
            "properties": {
                "minecraft": {
                    "description": "Version of Minecraft"
                },
                "forge": {
                    "description": "Version of Minecraft Forge"
                },
                "fabric-loader": {
                    "description": "Version of Fabric Loader"
                },
                "quilt-loader": {
                    "description": "Version of Quilt Loader"
                }
            }
        },
        "config": {
            "type": "object",
            "properties": {
                "ram": {
                    "type": "object",
                    "properties": {
                        "min": {
                            "type": "number",
                            "description": "Minimum number of gigabytes of RAM required (inclusive)"
                        },
                        "max": {
                            "type": "number",
                            "description": "Maximum number of gigabytes of RAM required (inclusive)"
                        }
                    }
                },
                "java": {
                    "type": "object",
                    "properties": {
                        "min": {
                            "type": "integer",
                            "description": "Minimum Java version allowed (inclusive)"
                        },
                        "max": {
                            "type": "integer",
                            "description": "Maximum Java version allowed (inclusive)"
                        }
                    }
                }
            }
        }
    }
}